{
  "city": "Avignon",
  "generated_at": "2025-01-03T12:00:00.000Z",
  "items_total": 24,
  "categories": {
    "Morning": [
      {
        "name": "Watch sunrise over the Rhône River from Rocher des Doms",
        "description": "Experience breathtaking sunrise views over the Rhône River with the medieval city skyline and Palais des Papes silhouetted against the morning sky.",
        "address": "Rocher des Doms, 84000 Avignon",
        "best_time": "morning",
        "seasonality": "year-round",
        "duration_minutes": 60,
        "lat": 43.9512,
        "lon": 4.8087,
        "geo_accuracy": "exact",
        "themes": [
          "views",
          "nature"
        ],
        "estimated_cost_eur": 0,
        "pricing_tier": "free",
        "booking_url": null,
        "scores": {
          "cultural_historical_significance": 8,
          "visitor_experience_quality": 9,
          "accessibility": 7,
          "value_for_money": 10,
          "uniqueness_to_avignon": 9,
          "photo_instagram_appeal": 10,
          "crowd_management": 9,
          "educational_value": 6,
          "family_friendliness": 8,
          "weather_independence": 6,
          "total_score": 8.2
        }
      },
      {
        "name": "Fresh Provençal produce from Les Halles market",
        "description": "Sample authentic Provençal specialties at the morning market while it's at its freshest, including local cheeses, olives, and seasonal produce.",
        "address": "Les Halles d'Avignon, Place Pie, 84000 Avignon",
        "best_time": "morning",
        "seasonality": "year-round",
        "duration_minutes": 30,
        "lat": 43.9497,
        "lon": 4.8064,
        "geo_accuracy": "exact",
        "themes": [
          "food",
          "local_culture"
        ],
        "estimated_cost_eur": 5,
        "pricing_tier": "€",
        "booking_url": null,
        "scores": {
          "cultural_historical_significance": 7,
          "visitor_experience_quality": 8,
          "accessibility": 9,
          "value_for_money": 9,
          "uniqueness_to_avignon": 8,
          "photo_instagram_appeal": 6,
          "crowd_management": 7,
          "educational_value": 6,
          "family_friendliness": 7,
          "weather_independence": 5,
          "total_score": 7.2
        }
      },
      {
        "name": "Visit Palais des Papes before the crowds",
        "description": "Explore the papal palace in peaceful morning hours, discovering the largest Gothic palace in Europe and its medieval grandeur.",
        "address": "Palais des Papes, Place du Palais, 84000 Avignon",
        "best_time": "morning",
        "seasonality": "year-round",
        "duration_minutes": 120,
        "lat": 43.9508,
        "lon": 4.8083,
        "geo_accuracy": "exact",
        "themes": [
          "history",
          "museums"
        ],
        "estimated_cost_eur": 12,
        "pricing_tier": "€€",
        "booking_url": "https://www.palais-des-papes.fr/",
        "scores": {
          "cultural_historical_significance": 10,
          "visitor_experience_quality": 9,
          "accessibility": 8,
          "value_for_money": 8,
          "uniqueness_to_avignon": 10,
          "photo_instagram_appeal": 9,
          "crowd_management": 8,
          "educational_value": 9,
          "family_friendliness": 7,
          "weather_independence": 9,
          "total_score": 8.9
        }
      },
      {
        "name": "Walk medieval ramparts for panoramic city views",
        "description": "Explore the well-preserved 14th-century ramparts offering unique perspectives of Avignon's medieval layout and surrounding countryside.",
        "address": "Remparts d'Avignon, 84000 Avignon",
        "best_time": "morning",
        "seasonality": "year-round",
        "duration_minutes": 90,
        "lat": 43.9508,
        "lon": 4.8083,
        "geo_accuracy": "approximate",
        "themes": [
          "history",
          "views"
        ],
        "estimated_cost_eur": 0,
        "pricing_tier": "free",
        "booking_url": null,
        "scores": {
          "cultural_historical_significance": 8,
          "visitor_experience_quality": 9,
          "accessibility": 7,
          "value_for_money": 10,
          "uniqueness_to_avignon": 9,
          "photo_instagram_appeal": 9,
          "crowd_management": 9,
          "educational_value": 7,
          "family_friendliness": 8,
          "weather_independence": 6,
          "total_score": 8.2
        }
      },
      {
        "name": "Coffee and calissons at traditional Provençal café",
        "description": "Start your day with strong French coffee and traditional almond sweets (calissons) at a local neighborhood café.",
        "address": "Place de l'Horloge, 84000 Avignon",
        "best_time": "morning",
        "seasonality": "year-round",
        "duration_minutes": 30,
        "lat": 43.9497,
        "lon": 4.8064,
        "geo_accuracy": "exact",
        "themes": [
          "food",
          "local_culture"
        ],
        "estimated_cost_eur": 4,
        "pricing_tier": "€",
        "booking_url": null,
        "scores": {
          "cultural_historical_significance": 6,
          "visitor_experience_quality": 7,
          "accessibility": 10,
          "value_for_money": 9,
          "uniqueness_to_avignon": 7,
          "photo_instagram_appeal": 5,
          "crowd_management": 8,
          "educational_value": 4,
          "family_friendliness": 9,
          "weather_independence": 9,
          "total_score": 7.4
        }
      },
      {
        "name": "Explore Cathédrale Notre-Dame des Doms",
        "description": "Visit the Romanesque cathedral with its golden Virgin Mary statue and papal tombs, offering beautiful morning light through stained glass.",
        "address": "Cathédrale Notre-Dame des Doms, Place du Palais, 84000 Avignon",
        "best_time": "morning",
        "seasonality": "year-round",
        "duration_minutes": 45,
        "lat": 43.9508,
        "lon": 4.8083,
        "geo_accuracy": "exact",
        "themes": [
          "history",
          "religion"
        ],
        "estimated_cost_eur": 0,
        "pricing_tier": "free",
        "booking_url": null,
        "scores": {
          "cultural_historical_significance": 9,
          "visitor_experience_quality": 8,
          "accessibility": 9,
          "value_for_money": 10,
          "uniqueness_to_avignon": 8,
          "photo_instagram_appeal": 7,
          "crowd_management": 8,
          "educational_value": 8,
          "family_friendliness": 7,
          "weather_independence": 9,
          "total_score": 8.3
        }
      }
    ],
    "Midday": [
      {
        "name": "Stroll through Place de l'Horloge",
        "description": "Experience the vibrant heart of Avignon with the famous clock tower, historic cafés, and people-watching opportunities.",
        "address": "Place de l'Horloge, 84000 Avignon",
        "best_time": "midday",
        "seasonality": "year-round",
        "duration_minutes": 60,
        "lat": 43.9497,
        "lon": 4.8064,
        "geo_accuracy": "exact",
        "themes": [
          "history",
          "local_culture"
        ],
        "estimated_cost_eur": 0,
        "pricing_tier": "free",
        "booking_url": null,
        "scores": {
          "cultural_historical_significance": 7,
          "visitor_experience_quality": 8,
          "accessibility": 10,
          "value_for_money": 10,
          "uniqueness_to_avignon": 7,
          "photo_instagram_appeal": 7,
          "crowd_management": 6,
          "educational_value": 6,
          "family_friendliness": 9,
          "weather_independence": 7,
          "total_score": 7.6
        }
      },
      {
        "name": "Authentic Provençal lunch at family-run restaurant",
        "description": "Taste traditional dishes like ratatouille, daube Provençale, and local goat cheese at authentic local establishments.",
        "address": "Rue des Teinturiers, 84000 Avignon",
        "best_time": "midday",
        "seasonality": "year-round",
        "duration_minutes": 90,
        "lat": 43.9489,
        "lon": 4.8056,
        "geo_accuracy": "approximate",
        "themes": [
          "food",
          "local_culture"
        ],
        "estimated_cost_eur": 25,
        "pricing_tier": "€€",
        "booking_url": null,
        "scores": {
          "cultural_historical_significance": 7,
          "visitor_experience_quality": 9,
          "accessibility": 8,
          "value_for_money": 8,
          "uniqueness_to_avignon": 8,
          "photo_instagram_appeal": 7,
          "crowd_management": 7,
          "educational_value": 6,
          "family_friendliness": 8,
          "weather_independence": 9,
          "total_score": 7.8
        }
      },
      {
        "name": "Explore Musée du Petit Palais art collection",
        "description": "Discover exceptional medieval and Renaissance art in this beautiful 14th-century palace, including works by Botticelli and other Italian masters.",
        "address": "Musée du Petit Palais, Place du Palais, 84000 Avignon",
        "best_time": "midday",
        "seasonality": "year-round",
        "duration_minutes": 120,
        "lat": 43.9508,
        "lon": 4.8083,
        "geo_accuracy": "exact",
        "themes": [
          "museums",
          "art"
        ],
        "estimated_cost_eur": 6,
        "pricing_tier": "€€",
        "booking_url": "https://www.petit-palais.org/",
        "scores": {
          "cultural_historical_significance": 9,
          "visitor_experience_quality": 9,
          "accessibility": 8,
          "value_for_money": 8,
          "uniqueness_to_avignon": 8,
          "photo_instagram_appeal": 7,
          "crowd_management": 8,
          "educational_value": 9,
          "family_friendliness": 6,
          "weather_independence": 10,
          "total_score": 8.2
        }
      },
      {